Business Name,Description,Web Site,City,Latitude,Longitude,Keywords,Region,Type,Industry Sector,Year Formed,Number of Employees
'Ksan Campground,,http://www.gitanmaax.com/SitePages/KSAN.aspx,Hazelton,55.2558334,-127.6755555,"'Ksan Campground, ",North Coast,Community Owned,,1969,5 to 9
Ksan Historical Village,"Ksan Historical Village and Museum ('Ksan) is a cultural centre dedicated to illustrating the richness of Gitxsan culture and history. During the past forty-nine years 'Ksan has maintained this mandate, and also provided economic opportunities for First Nations people of the Upper Skeena River region.",http://www.ksan.org,Hazelton,55.2625999,-127.6473999,"Ksan Historical Village, 71 - Arts, entertainment and recreation",North Coast,,"71 - Arts, entertainment and recreation",,
Ksan Historical Village and Museum,"Ksan Historical Village and Museum (˜Ksan) is a cultural centre dedicated to illustrating the richness of Gitxsan culture and history. During the past forty-nine years ˜Ksan has maintained this mandate, and also provided economic opportunities for First Nations people of the Upper Skeena River region. ",http://ksan.org,Hazelton,55.2596329,-127.6537263,"Ksan Historical Village and Museum, 71 - Arts, entertainment and recreation",North Coast,Community Owned,"71 - Arts, entertainment and recreation",1968,1 to 4
KSDavison & Associates,"KSDavison & Associates (7726929 Canada Inc.) is an Aboriginal-owned consulting firm providing a full compliment of services related to completing regulatory and community-based traditional knowledge, land use and occupancy studies, including technical writing, transcription, GIS and fieldwork. Our experience includes working with First Nations and M etis communities across western Canada, in all major natural resources sectors.",http://www.ksdandassociates.com,New Westminster,49.2147031,-122.8977928,"KSDavison & Associates, 54 - Professional, scientific and technical services",Lower Mainland / Southwest,Private Company,"54 - Professional, scientific and technical services",,
Kuehne + Nagel Ltd.- Haisla Joint Venture Partnership,"Seafreight, airfreight, road, and contract logistics, with a clear focus on providing IT-based supply chain solutions.",http://www.kn-portal.com/locations/north_america/canada/,Kitimat,54.0532502,-128.6600177,"Kuehne + Nagel Ltd.- Haisla Joint Venture Partnership, 48-49 - Transportation and warehousing",North Coast,Joint Venture,48-49 - Transportation and warehousing,,
Kulus Consulting and Development ,"Kulus Consulting & Development is an Aboriginal owned company committed to providing the First Nation, Kulus Consulting provides educational training in the areas of Aboriginal law and Court-recognized Expert Gladue Reports for purposes of bail, sentencing, dangerous offender hearings, appeal and parole. In Addition we provide expertise in the area of clinical assessment, case management and reintegration to our clients within the social services, corrections, and criminal justice community. As a further part of our range of services, Kulus also specializes in Aboriginal social enterprises, economic development and facilitating cultural competency and interface training.  ",http://www.gladuereports.com,Cquitlam,49.266627,-122.8548958,"Kulus Consulting and Development , 54 - Professional, scientific and technical services",Lower Mainland / Southwest,Private Company,"54 - Professional, scientific and technical services",,
Kuterra ,"KUTALA means salmon in the language of the 'Namgis people. TERRA means land. And KUTERRA means salmon from the land.    KUTERRA is also a business, fully owned by the 'Namgis First Nation, and supported in different ways by people and groups locally and internationally.    The KUTERRA mission is to bring the most environmentally sound, safe and healthy farmed salmon to people who care about the food they eat and serve to their families.    This mission unites the 'Namgis First Nation, project partner SOS Marine Conservation Foundation, funder and advisor Tides Canada and seafood distributor Albion Fisheries.    We chose to start the KUTERRA farm to show that Land Raised ""¢ salmon is the future of sustainable salmon farming. It's the way to keep wild salmon and the waters they live in separate from farming, and the way to grow the best quality farmed fish.    Our farm is located on Northern Vancouver Island, a kilometre from the ocean. Our farm team has years of international training and expertise in raising many different species of fish, and is excited to show the world our KUTERRA Atlantic salmon.    Contact us any time to learn which stores and restaurants carry premium quality KUTERRA salmon, or to learn more about what we are doing and why.",http://www.kuterra.com/,Alert Bay,50.5951217,-126.9280404,"Kuterra , 11 - Agriculture, forestry, fishing and hunting",Vancouver Island / Coast,Joint Venture,"11 - Agriculture, forestry, fishing and hunting",2013,
Kwadacha Community Store ,,,Fort Ware,57.4208334,-125.6222222,"Kwadacha Community Store , 44-45 - Retail trade",Northeast,Community Owned,44-45 - Retail trade,2012,5 to 9
Kwadacha Nation Resources Limited Partnership,"This is a partnership between the Band and its resource entity. KNRLP manages all resources including mining, forestry, and hunting.",,Fort Ware,57.4208334,-125.6222222,"Kwadacha Nation Resources Limited Partnership, 21 - Mining, quarrying, and oil and gas extraction",Northeast,Partnership,"21 - Mining, quarrying, and oil and gas extraction",2003,1 to 4
Kwadacha Natural Resources Agency Ltd.,Natural Resources Company\Obo Forest Management  Forestry Tenure operations  Silviculture  Road maintenance and other equipment services  Mining Negotiations  Employment and training,http://www.kaskadenacouncil.com/kaska-nations/kwadacha-nation,Fort Ware,57.4208334,-125.6222222,"Kwadacha Natural Resources Agency Ltd., 55 - Management of companies and enterprises",Northeast,Community Owned,55 - Management of companies and enterprises,2004,20 to 49
Kwadacha Saw Mill,,,Prince George,53.913274,-122.733321,"Kwadacha Saw Mill, 31-33 - Manufacturing",Northeast,Community Owned,31-33 - Manufacturing,2003,1 to 4
Kwagis Power,"The Kokish River hydroelectric facility (Kwagis Power) is located on north-eastern Vancouver Island, about 15 kilometres east of Port McNeill, British Columbia, and is owned and operated by a limited partnership between Brookfield Renewable and the 'Namgis First Nation.",http://www.namgis.bc.ca/companies/kwagis-power-limited-partnership/,Alert Bay,50.5951217,-126.9280404,"Kwagis Power, 22 - Utilities",Vancouver Island / Coast,Joint Venture,22 - Utilities,2014,
Kwakwati - Sea Otter Taxi,Water Taxi Services between Kyuquot and Fair Harbour,,Kyuquot,50.0333334,-127.3666667,"Kwakwati - Sea Otter Taxi, 48-49 - Transportation and warehousing",Vancouver Island / Coast,Private Company,48-49 - Transportation and warehousing,,
Kwassen Productions Inc.,"100% First Nations production company dedicated to making your creative ideas a reality from concept to a finished product.  For all your production needs including PSA's Corporate, TV and documentaries, we are what you are looking for.",http://www.kwassen.ca,Victoria,48.4146197,-123.3791794,"Kwassen Productions Inc., 51 - Information and cultural industries",Vancouver Island / Coast,Private Company,51 - Information and cultural industries,2009,1 to 4
KWDuCharme Consulting Services,"Kevin DuCharme has over 25 years of experience in the sport and recreation field, planning, organizing and delivering successful programs ranging in size from municipal recreation programs to National Championships, World Championships and Olympic and Paralympic Games. Specializing in Supply Chain Management, Kevin DuCharme is a Professional Logistician (P.Log) who utilizes the broad experience and organizational skills that he has developed as a key member of several extremely high profile, complex and successful international organizations to provide world class solutions that make sense. Kevin has provided Supply Chain/ Logistics Consulting Services to several major organizations such as the Sochi 2014 Olympic and Paralympic Winter Games, the City of Vancouver and Seaspan Vancouver Shipyards.",,Port Moody,49.2836407,-122.8692596,"KWDuCharme Consulting Services, 54 - Professional, scientific and technical services",Lower Mainland / Southwest,Private Company,"54 - Professional, scientific and technical services",2013,
Kweykway Consulting,"Kweykway is a grassroots First Nations service specializing in a full array of restorative processes that support organizational and community development. We are dedicated to building capacity in the areas of community engagement, childcare and parenting, influencing change, creating strong collaborative relationships, minimizing the negative affects of conflict, minimizing incidents of aggression and violencee and improving overall communication while restoring a sense of trust, belonging, and well being.",http://www.kweykway.ca,West Vancouver,49.3225819,-123.1307852,"Kweykway Consulting, 54 - Professional, scientific and technical services",Lower Mainland / Southwest,Private Company,"54 - Professional, scientific and technical services",,1 to 4
Kwisitis Feasthouse,"Perched at the east end of Wickanninish Beach, with arguably the most stunning location on the Coast, the Kwisitis Feast House delights diners with a menu inspired by authentic First Nations cuisine. Enjoy a lunch of traditional fish soup and bannock while taking in the surfers along the breathtaking expanse of Wick Beach. As the day comes to an end, bask in a spectacular sunset while indulging in local Dungeness crab or a BBQd locally caught fresh salmon fillet.",http://www.kwisitisfeasthouse.com,Ucluelet,48.94031772,-125.5459213,"Kwisitis Feasthouse, 72 - Accommodation and food services",Vancouver Island / Coast,,72 - Accommodation and food services,,
Kyah Industries Ltd.,Logging company owned by Moricetown Band.,http://mbed.ca/business-relationships/kyah-industries-ltd/,Smithers,55.019494,-127.330422,"Kyah Industries Ltd., 11 - Agriculture, forestry, fishing and hunting",North Coast,Community Owned,"11 - Agriculture, forestry, fishing and hunting",,
Kyahwood Forest Products,Wood product manufacturing/ finger joint plant.,http://kyahwood.com/,Moricetown,55.0112313,-127.3425886,"Kyahwood Forest Products, 31-33 - Manufacturing",North Coast,Community Owned,31-33 - Manufacturing,1995,20 to 49
L & S Custom Sawmills,,,Heffley Creek,50.8434085,-120.0664343,"L & S Custom Sawmills, 11 - Agriculture, forestry, fishing and hunting",Thompson / Okanagan,,"11 - Agriculture, forestry, fishing and hunting",,
La Liberte Cronin & Co,Terry La Liberte & Kassandra Cronin are criminal defence lawyers who represent clients facing criminal charges. Combined they have 50 years of experience.,http://bc-criminal-law.com,Vancouver,49.2810971,-123.1188201,"La Liberte Cronin & Co, 54 - Professional, scientific and technical services",Lower Mainland / Southwest,Private Company,"54 - Professional, scientific and technical services",1999,1 to 4
Lake Babine Nation Economic Development Society,,http://www.lakebabine.com/,Burns Lake,54.4389514,-124.2559907,"Lake Babine Nation Economic Development Society, 55 - Management of companies and enterprises",Nechako,Community Owned,55 - Management of companies and enterprises,2010,
Lakeshore Resort & Campground,"The Lakeshore resort and Campground is the Columbia Valley's largest campground located on the pristine shores of Lake Windermere, BC. ",http://www.lakeshoreresortcampground.com/,Windermere,50.4748958,-115.9876184,"Lakeshore Resort & Campground, 71 - Arts, entertainment and recreation",Kootenay,Community Owned,"71 - Arts, entertainment and recreation",,10 to 19
Lakeview Gas Station,"Full convenience store, fuel services, arts and crafts, also sells tires on location",,Quilchena,50.1228632,-120.7662389,"Lakeview Gas Station, 44-45 - Retail trade",Thompson / Okanagan,Private Company,44-45 - Retail trade,,5 to 9
Lama Pass Fuel Co. Ltd,,http://www.heiltsukdevco.com/hedc-business/group-of-companies,Bella Bella,52.160543,-128.145584,"Lama Pass Fuel Co. Ltd, ",Vancouver Island / Coast,Community Owned,,,
LaRock Dezines," My name is Nikki LaRock and I do ""Vintage Native Fashion Designing"" And how this works, is I upcycle ""your own"" clothing by adding LaRock Dezines either with fabric paint or appliqu e to create a unique piece just for you  All designs are my own designs. When I paint its all freehand and I go with what I feel. When you make a custom order from LaRock Dezines, you will be the ONLY person in the WORLD to own your piece as I rarely do duplicates of my work.   ",,Chilliwack,49.13299,-121.9207919,"LaRock Dezines, 81 - Other services (except public administration)",Lower Mainland / Southwest,Private Company,81 - Other services (except public administration),2004,
LaRock's Chop Shop,,,Chilliwack,49.13299,-121.9207919,"LaRock's Chop Shop, 81 - Other services (except public administration)",Lower Mainland / Southwest,Private Company,81 - Other services (except public administration),,
Latash Native Art,Latash Native Arts is a 100 percent Aboriginal owned and managed business providing Native art and cultural presentations.,https://www.facebook.com/Latash7,North Vancouver,49.3183208,-123.0883392,"Latash Native Art, 71 - Arts, entertainment and recreation",Lower Mainland / Southwest,Private Company,"71 - Arts, entertainment and recreation",,
Lavina Estates,Vinyard and wine sales. ,,Armstrong,50.4998256,-119.2462285,"Lavina Estates, 31-33 - Manufacturing",Thompson / Okanagan,Private Company,31-33 - Manufacturing,2013,1 to 4
Lawn Sharks Yard Care,"Basic Yard Care: Lawn Cutting & Hardline, Weeding, Trimmings, Planting, Hedge Trimming",,Port Alberni,49.2344445,-124.8058333,"Lawn Sharks Yard Care, 11 - Agriculture, forestry, fishing and hunting",Vancouver Island / Coast,Private Company,"11 - Agriculture, forestry, fishing and hunting",2011,1 to 4
Lax Kw'alaams Construction Solutions Group,"The Lax Kw'alaams Construction Solutions Group has more than 300 pieces of equipment that is ready to undertake all aspects of construction works related to LNG, including but not limited to: Access road construction; Site development and road right-of-way; Structural works; Paving; Drill, blast, crush, haul, place, and level fill; Building construction and erection; Construction of marine structures, pile driving, marine dredging; Airstrip construction; Bonding.",,Port Simpson,54.5582285,-130.4334676,"Lax Kw'alaams Construction Solutions Group, 23 - Construction",North Coast,Partnership,23 - Construction,,
Lax Kw'alaams Energy Rentals Inc.,"Able to satisfy all your rental needs, including: Light towers/portable generators; Enviro trailers; Portable sewage treatment plants; Portable water tanks; Portable drilling equipment; Garbage trailers; Fire suppression trailers; Portable fire suppression pumps; Medic aid shacks; Flat deck trailers; Access matting; Fuel skids; Rig matting; Job site supervisor shacks; 50/50 engineers shacks; Open office job site meeting room   shacks; Fluid containment systems and liners; Pile driving crews and equipment",,Port Simpson,54.5582285,-130.4334676,"Lax Kw'alaams Energy Rentals Inc., 53 - Real estate and rental and leasing",North Coast,Partnership,53 - Real estate and rental and leasing,,
Lax Kw'alaams Environmental Remediation Group LP,"Providing turnkey environmental remediation services to municipalities, government, and industry.   ",,Port Simpson,54.5582285,-130.4334676,"Lax Kw'alaams Environmental Remediation Group LP, 23 - Construction",North Coast,Partnership,23 - Construction,,
Lax Kw'alaams Ferry Corporation,Ferry operations.,,Prince Rupert,54.3127778,-130.3252778,"Lax Kw'alaams Ferry Corporation, 48-49 - Transportation and warehousing",North Coast,Community Owned,48-49 - Transportation and warehousing,,5 to 9
Lax Kw'alaams Holdings Ltd.,Real estate development company.,,Prince Rupert,54.5582285,-130.4334676,"Lax Kw'alaams Holdings Ltd., 53 - Real estate and rental and leasing",North Coast,Community Owned,53 - Real estate and rental and leasing,2011,
"Lax Kw'alaams Modular, Sales, and Leasing Solutions LP",Renting and selling permanent and temporary modular buildings throughout the traditional territory of the Lax Kwalaams.,,Port Simpson,54.5582285,-130.4334676,"Lax Kw'alaams Modular, Sales, and Leasing Solutions LP, 53 - Real estate and rental and leasing",North Coast,Partnership,53 - Real estate and rental and leasing,,
Laxgalts'ap Forest Company Ltd,,,Greenville,55.0547288,-129.5226203,"Laxgalts'ap Forest Company Ltd, 11 - Agriculture, forestry, fishing and hunting",North Coast,Community Owned,"11 - Agriculture, forestry, fishing and hunting",,
Le7Ke Spa,"Full spa services: anti-aging facials, oil blends, aroma-therapy, massages, manicures and pedicures",http://www.quaaoutlodge.com,Chase,50.8757408,-119.6152098,"Le7Ke Spa, 44-45 - Retail trade",Thompson / Okanagan,Private Company,44-45 - Retail trade,,
Leader Silviculture Ltd.,"Leader Silviculture offers a full range of silviculture services in keeping with small business values. We deliver personalized solutions using experienced local staff. We believe in using innovation and creativity to improve cost effectiveness while maintaining high quality standards. We are committed to supporting and strengthening the communities in which we live and work. Founded in 1992, Leader Silviculture specializes in tree planting, mechanical and chemical brushing, protection installation, as well as spacing, pruning and slashing. This diversity of work enables us to offer steady employment from April to December. Our core workforce shares a common passion and constant dedication to the outdoors: we work hard during the summer months and play on the mountains during the winter. Our Company logo is a testament to this philosophy.",https://leadersilviculture.wordpress.com/,Garibaldi Highlands,49.3138033,-122.9748243,"Leader Silviculture Ltd., 11 - Agriculture, forestry, fishing and hunting",Lower Mainland / Southwest,Private Company,"11 - Agriculture, forestry, fishing and hunting",,
Leanne Helin Tsimshian Native Jewellery,"One of a kind or corporate gifts Cuff Links, Lapel pins, Pendants, Earrings, Bracelets and Watch bracelets. Also ear cuff, and finger nail covers. Hand drawn and carve contemporary Tsimshian Native designs into Sterling Silver, copper and Gold. Leanne's Originals are totally created in her studio by her. ",http://www.leannehelin.com,Nanoose Bay,49.2640827,-124.2364353,"Leanne Helin Tsimshian Native Jewellery, 44-45 - Retail trade",Vancouver Island / Coast,Private Company,44-45 - Retail trade,1991,
Ledcor Kitimat ,"Ledcor handles all aspects of heavy industrial construction in all sizes of projects across a range of sectors, including Energy, Forestry, Mining, Oil and Gas, Manufacturing, and Oilsands.",http://haisla.ca/,Kitimat Village,53.973206,-128.648071,"Ledcor Kitimat , 23 - Construction",North Coast,Joint Venture,23 - Construction,,
Legend Logos,Handcrafted Items  Embroidery  Bradford Exchange  Collectables  Pictures  Decorator Items  Christmas  Pendleton Items  Leaning Tree  Angels  Steel Art  Steel Wall Hangings  Legend Books  Bergsma Gallery  Accessories & Jewelry  Hot Items  ,,Creston,49.064094,-116.5201159,"Legend Logos, 71 - Arts, entertainment and recreation",Kootenay,Private Company,"71 - Arts, entertainment and recreation",,5 to 9
Leko Precast Ltd 2011,"Leko Precast Ltd. has been manufacturing a range of quality precast concrete products, including Concrete Toilet Buildings, since 1975.We are a local Manufacturer in the Okanagan Valley for over 30 years.",http://www.lekoprecast.com/,Vernon,50.2666667,-119.2716667,"Leko Precast Ltd 2011, 23 - Construction",Thompson / Okanagan,Private Company,23 - Construction,,
lelem' Arts & Cultural Cafe,"lelem' means house in our hul'qumi'num language.  For countless generations, Kwantlen people have lived in present-day Fort Langley and the surrounding areas along the Fraser River.    Kwantlen translates to ""tireless runner"". Following our rich legacy and traditions, we continue to work tirelessly at building a strong sense of community within our traditional territory.",http://lelem.ca/,Fort Langley ,49.16038366,-122.5884224,"lelem' Arts & Cultural Cafe, 72 - Accommodation and food services",Lower Mainland / Southwest,,72 - Accommodation and food services,,
Leon Taylor Trucking,Leon Taylor Trucking is a log hauling business. ,,Burns Lake,54.2302778,-125.7644444,"Leon Taylor Trucking, 11 - Agriculture, forestry, fishing and hunting",Nechako,Private Company,"11 - Agriculture, forestry, fishing and hunting",1981,1 to 4
Leroger Consulting Ltd.,"Roger Leclerc is president of LeRoger Consulting Ltd. He has a Masters Degree in Leadership and Training from Royal Roads University, and extensive management experience in economic development, business development and training and possesses expertise in Aboriginal research and engagement. Before Roger moved into managing training centres, which included manager of Kitimat Valley Institute (an accredited private post-secondary institution owned by Haisla Nation and Rio Tinto Alcan), he owned/operated a logging/construction company for many years. Roger previously managed a Communities Futures Development Corporation for 5 years and previous to that sat on their Board of Directors and was involved on Economic Development Commission for the City of Terrace for 5 years.    In the past few years Roger has worked with consultants on research projects at a provincial level. The first research project was a study of Aboriginal Housing in BC which was commissioned by the Province of BC. The second study was on Aboriginal Apprenticeship which was commissioned by ITA and Aboriginal Human Resource Council.    Roger presently serves on Coast Mountain School District #82 Board as vice-chair, ITAs Aboriginal Apprentice Advisory Committee and the Province of BC Passenger Transportation Board as a Director.",,Terrace,54.5313,-128.5886166,"Leroger Consulting Ltd., 54 - Professional, scientific and technical services",North Coast,Private Company,"54 - Professional, scientific and technical services",2011,1 to 4
Les Sam Construction,"New home construction, renovations, general contractor, framing, concrete, architectural and structural services.",,Port Alberni ,49.2689498,-124.8656625,"Les Sam Construction, 23 - Construction",Vancouver Island / Coast,Private Company,23 - Construction,1986,1 to 4
LHI Tutl'it,LHI Tutl'it safeguards the building and maintenance of utility access and energy or exploration corridors.,http://www.lhi-services.ca/,Prince George,53.9262282,-122.7598532,"LHI Tutl'it, 23 - Construction",Cariboo,Private Company,23 - Construction,,
Liard Hotspings Lodge,"Lodge, RV Park, Campground",,Northern Rockies B,59.4246958,-126.1036926,"Liard Hotspings Lodge, 71 - Arts, entertainment and recreation",Northeast,Community Owned,"71 - Arts, entertainment and recreation",,
Lightfoot Gas Station,"Full service gas station, convenience store, baking and sweets, catering services, coffee shop",,Lillooet,49.6959834,-123.1444999,"Lightfoot Gas Station, 44-45 - Retail trade",Lower Mainland / Southwest,Private Company,44-45 - Retail trade,1995,20 to 49
Lil'wat Business Corporations,"Through Lilwat Business Corporations, Lilwat is working to bridge on and off reserve interests through profitable partnerships. This business model has resulted in successful partnerships on independent power projects, forestry and silviculture, general contracting and construction, and, land acquisition and development. We also own our own gas station and corner store.",,Mount Currie,50.3166667,-122.7166667,"Lil'wat Business Corporations, 55 - Management of companies and enterprises",Lower Mainland / Southwest,Development Corporation,55 - Management of companies and enterprises,,
Lil'Wat Gas Station ,"The Lil'Wat Gas Station and convenience store is owned by Mount Currie Management Inc., a Lil'Wat band-owned company.",,Mount Currie,50.3166667,-122.7166667,"Lil'Wat Gas Station , 44-45 - Retail trade",Lower Mainland / Southwest,Community Owned,44-45 - Retail trade,2009,
Limelight Signs,Vinyl Sign and decal business  ,http://www.limelightsigns.ca/,Chilliwack,49.0988166,-121.9311091,"Limelight Signs, 44-45 - Retail trade",Lower Mainland / Southwest,Private Company,44-45 - Retail trade,2007,
Lincoln Centre Chiropractic,"Chiropractic Services, Electrotherapy, Sports Care, Orthotics",http://www.coquitlamchiropractic.com,Coquitlam,49.2789649,-122.7926999,"Lincoln Centre Chiropractic, 62 - Health care and social assistance",Lower Mainland / Southwest,Private Company,62 - Health care and social assistance,,
Linda D. Thomas Barrister and Solicitor,"Legal Services in the area of Child Protection, family law and First Nations Justice, Governance issues.",,Kamloops,50.6662086,-120.3512741,"Linda D. Thomas Barrister and Solicitor, 54 - Professional, scientific and technical services",Thompson / Okanagan,Private Company,"54 - Professional, scientific and technical services",2003,1 to 4
"Lisa Shepherd, Metis Artisan","M etis Artisan produces culturally inspired one-of-a-kind garments and provides workshops, presentations and teachings of cultural artwork and dance. The artwork includes custom beaded moccasins, garments and jewellery and commissioned traditional and contemporary products.",http://lisashepherd.ca/,Kamloops,50.6758334,-120.3394444,"Lisa Shepherd, Metis Artisan, 71 - Arts, entertainment and recreation",Thompson / Okanagan,Private Company,"71 - Arts, entertainment and recreation",,
