Business Name,Description,Web Site,City,Latitude,Longitude,Keywords,Region,Type,Industry Sector,Year Formed,Number of Employees
Ruby Creek Art Gallery,"The Ruby Creek Art Gallery, located on scenic highway #7 between the towns of Agassiz and Hope is committed to promoting the work of the finest Northwest First Nations artists. The gallery is owned and operated by the Skawahlook First Nation.    The gallery features an extraordinary collection of Pacific Northwest Native art which includes limited addition prints, gold and silver carved jewelry, hand carved boxes, chests, and plaques, handcrafted drums, soapstone and textiles.",http://rubycreekartgallery.com/,Agassiz ,49.2472047,-121.7782606,"Ruby Creek Art Gallery, 71 - Arts, entertainment and recreation",Lower Mainland / Southwest,Community Owned,"71 - Arts, entertainment and recreation",2006,1 to 4
Ruby Rock Resources,"A resource partnership focused on mining, pipelines, civil engineering and logging/forestry.",,Prince George,53.9198873,-122.7555575,"Ruby Rock Resources, 21 - Mining, quarrying, and oil and gas extraction",Cariboo,Partnership,"21 - Mining, quarrying, and oil and gas extraction",2008,5 to 9
Rupert Lawn & Garden,"Owned and operated by the Gitmaxmak'ay Nisga'a, Rupert Lawn & Garden is a greenhouse and garden centre retail business as well as a lawn care service provider in Prince Rupert, B.C.",http://www.rupertlawn.ca/,Prince Rupert ,54.3301505,-130.284656,"Rupert Lawn & Garden, 54 - Professional, scientific and technical services",North Coast,Community Owned,"54 - Professional, scientific and technical services",2013,5 to 9
Ruskin Construction Ltd. / Haisla Business Operations JV,"Ruskin Construction Ltd. specializes in bridges, foundations, marine, railway, aerial pipeline and heavy civil construction services.  ",http://www.ruskinconstruction.com/,Prince George,53.9277968,-122.7113332,"Ruskin Construction Ltd. / Haisla Business Operations JV, 23 - Construction",North Coast,Joint Venture,23 - Construction,,
S & D Muir Inc,Consulting and safety for mine site drilling. Also oil and gas consulting. ,,Merritt,50.1202072,-120.7767818,"S & D Muir Inc, 21 - Mining, quarrying, and oil and gas extraction",Thompson / Okanagan,Private Company,"21 - Mining, quarrying, and oil and gas extraction",,
Sabo Jang & Co Ltd,"We provide professional services for: Corporations, Professionals, Proprietorships, Partnerships,Individuals,Estates,Trusts,Societies  Not-For-Profit Organizations",http://www.saboco-cga.com,Parksville,49.3199605,-124.3165033,"Sabo Jang & Co Ltd, 54 - Professional, scientific and technical services",Vancouver Island / Coast,Partnership,"54 - Professional, scientific and technical services",1998,5 to 9
Sa-Cinn Native Entreprises Ltd.,Committed to providing affordable authentic  north west coast native art.,http://www.sa-cinn.com,Chemainus,48.9166667,-123.7166667,"Sa-Cinn Native Entreprises Ltd., 81 - Other services (except public administration)",Vancouver Island / Coast,Private Company,81 - Other services (except public administration),1986,1 to 4
Safe-Harbour Informatics Inc.,"Safe Harbour Informatics Inc is a leading managed service provider of network support and maintenance services. We assess, design, build, repair, deploy, and manage networks. Our network support capabilities range from simple IT moves, hardware and software installations, to help desk remote network performance management. All these capabilities assure that your computers operate at optimal performance with maximum cost-efficiency. We provide high quality Remote and Onsite Technical Support to handle all aspect of your business computer needs.",http://www.safe-harbour.ca,Vancouver,49.2262854,-123.1965315,"Safe-Harbour Informatics Inc., 54 - Professional, scientific and technical services",Lower Mainland / Southwest,Private Company,"54 - Professional, scientific and technical services",2008,5 to 9
Sagebrush Downs,"The Sagebrush Downs/ Mt. Paul Centre is one of western Canadas best class ""Bhorse racing tracks. Located in the sunny interior of British Columbia on the TteS reserve, the facility is owned and operated by the TteS.    Sagebrush Downs/Mt. Paul Centre offers: 1-mile Track,  Round Pen Outdoor Arena, Stall Rentals.    The grounds, buildings and facilities can be rented for: Rodeos/Barrel Racing, Hunter Jumper Shows, English, Horse Shows, Sulky Racing, Horse Racing, Weddings",http://www.tkemlupsbusiness.ca/businesses/sagebrush-downs,Kamloops,50.6803744,-120.2947475,"Sagebrush Downs, 71 - Arts, entertainment and recreation",Thompson / Okanagan,Community Owned,"71 - Arts, entertainment and recreation",,
Sahtaneh Contracting Ltd.,"Labour contracting and slashing, burning, mulching, equipment rental, pipeline, line clearing and seeding.",,Fort Nelson,58.8055556,-122.6972222,"Sahtaneh Contracting Ltd., 23 - Construction",Northeast,Private Company,23 - Construction,,
Sa'lish Archaeology & C.R.M. Ltd,,,Merritt,50.1314272,-120.8337586,"Sa'lish Archaeology & C.R.M. Ltd, 54 - Professional, scientific and technical services",Thompson / Okanagan,,"54 - Professional, scientific and technical services",,
Salish Dreams,"Cedar hats, clothing, moccassins, beading",,Tsawwassen ,49.0080556,-123.1283333,"Salish Dreams, 44-45 - Retail trade",Vancouver Island / Coast,Private Company,44-45 - Retail trade,2004,1 to 4
Salish Eye Productions,"We are a fully-insured Aboriginal multimedia design business that focuses on creating beautiful and meaningful content through photography, videography, aerial services, web design, and branding.",http://www.salisheye.com/,Chemainus,48.8755399,-123.6944621,"Salish Eye, 71 - Arts, entertainment and recreation",Vancouver Island / Coast,Private Company,"71 - Arts, entertainment and recreation",,
Salish Fusion Knitwear,"Salish Fusion Knitwear is owned by the Olsen family and is based in the traditional territory of the WSANEC (Saanich) People in Brentwood Bay, on Vancouver Island, British Columbia, Canada. All work is performed by Vancouver Island knitters who are highly valued, fairly paid and profit from this venture.",http://salishfusion.ca/,Brentwood Bay,48.5796548,-123.4598571,"Salish Fusion Knitwear, 31-33 - Manufacturing",Vancouver Island / Coast,Private Company,31-33 - Manufacturing,2011,
Salish Painting,Commercial/ Residential interior and exterior painting,,Tsawwassen,49.0353837,-123.097252,"Salish Painting, 81 - Other services (except public administration)",Vancouver Island / Coast,Private Company,81 - Other services (except public administration),2014,5 to 9
Salish Sea Industrial Services Ltd.,"Salish Sea Industrial Services Ltd provides marine industrial services on Vancouver Island including:   Dredging; Pile driving; Water and land based construction, maintenance, restoration and deconstruction; Marine safety and marine support. Salish Sea also provides skilled trades and general labour employment training and placement services for the Victoria BC industrial market area.",,Victoria,48.4283334,-123.3647222,"Salish Sea Industrial Services Ltd., 23 - Construction",Vancouver Island / Coast,Partnership,23 - Construction,,
Salishan Catering Ltd.,"Salishan Catering LTD services the lowermainland and British Columbia, also have catered out of the country. We provide FirstNation or Aboriginal foods of Canada. We have a native touch with West Coast Art theme's. Our company is owened and oprated by First Nations people of Canada. We have catered to Federal and Provincial governments, Cities, Municipalities, University of British Columbia and other Universities in Canada, Corporations and many companies through out the lowermainland of Vancouver.  ",http://www.salishancatering.com,Vancouver,49.2262444,-123.1977641,"Salishan Catering Ltd., 72 - Accommodation and food services",Lower Mainland / Southwest,Private Company,72 - Accommodation and food services,,10 to 19
Salmon n' Bannock Bitsro Ltd.,"Proudly serving wild local fish, organic and free range meats, bannock and other culinary delights inspired by a variety of  First Nations traditions.",http://www.salmonandbannock.net/index.html,Vancouver,49.2631378,-123.1296705,"Salmon n' Bannock Bitsro Ltd., 72 - Accommodation and food services",Lower Mainland / Southwest,Private Company,72 - Accommodation and food services,,
Salpac Fisheries Ltd.,Salpac Fisheries (GP) Ltd.  manages the leasing of licenses and quotas accessed by the joint venture partners through the Government of Canada - Department of Fisheries and Oceans Pacific Integrated Commercial Fisheries Initiative (PICFI).   ,,Nanaimo,49.1638889,-123.9380556,"Salpac Fisheries Ltd., 11 - Agriculture, forestry, fishing and hunting",Vancouver Island / Coast,Joint Venture,"11 - Agriculture, forestry, fishing and hunting",2012,
Sal's Ironworks,Mechanics/ Welding/ Fabricating,,Dease Lake,58.4333334,-130.0241667,"Sal's Ironworks, 31-33 - Manufacturing",Nechako,Private Company,31-33 - Manufacturing,2011,
Sam Witch's Catering,,,Fort St James,54.4389514,-124.2559907,"Sam Witch's Catering, 72 - Accommodation and food services",Nechako,Partnership,72 - Accommodation and food services,2011,1 to 4
Sam's Carving Shop,"Custom wood carving by Sam Robinson, a Haisla artist who has been carving for 70 years.  ",,Kitimat,54.057486,-128.6868957,"Sam's Carving Shop, 71 - Arts, entertainment and recreation",North Coast,Private Company,"71 - Arts, entertainment and recreation",,
Samuel Ennis: RE/MAX Ocean Pacific Realty,Comox Valley Real Estate Professional for Courtenay and the Comox Valley,http://www.comoxvalleyhousehunters.com,Courtenay,49.6766705,-124.9351669,"Samuel Ennis: RE/MAX Ocean Pacific Realty, 53 - Real estate and rental and leasing",Vancouver Island / Coast,Private Company,53 - Real estate and rental and leasing,,
Sana'aih Market,Grocery Store,,Fort St James,54.4444445,-124.2591667,"Sana'aih Market, 44-45 - Retail trade",Nechako,Community Owned,44-45 - Retail trade,2009,20 to 49
Sands Little Store,A small convenience store that also sells native cigarettes.  ,,Chilliwack,49.1722496,-121.9484941,"Sands Little Store, 44-45 - Retail trade",Lower Mainland / Southwest,Private Company,44-45 - Retail trade,2005,1 to 4
Sandy Pines Campground,"Activity based campground with snowmobile tours, festivals, holistic healing retreats, yoga.",http://www.sandypinescampground.com/,Boston Bar,49.8666667,-121.4333333,"Sandy Pines Campground, 72 - Accommodation and food services",Thompson / Okanagan,Private Company,72 - Accommodation and food services,2010,1 to 4
Sarvair Aviation,"Sarvair Aviation is a 100% Aboriginal owned and operated helicopter charter company, with bases in Williams Lake and 108 Mile Ranch Airport in BC, Canada.     Sarvair operates Eurocopter Astar 350 and Robinson R44 helicopters, which are capable of many different tasks.     Sarvair offers many different services throughout Canada. We specialize in long-line and vertical lift operations such as heli logging, drill moves, tower and cone construction, and forest fire protection.    We also offer general charter, medivac service, heli-hiking or fishing , and heli-rides.",http://www.sarvair.com,100 Mile House,51.6427778,-121.2955556,"Sarvair Aviation, 48-49 - Transportation and warehousing",Cariboo,Private Company,48-49 - Transportation and warehousing,2003,
Sarver Wood Fibre,Sarver Wood Fibre Ltd provides Heli Logging and Conventional logging services and operates a custom cut sawmill milling timbers up to 50 feet long. The Company also provides Forest Fire Fighting services and Danger Tree Falling and Danger Tree Assessing services. Sarver Wood Fibre Ltd owns a airport hanger at the Williams Lake Airport and rents hanger space for aircraft repairs or storage. ,http://www.sarverwoodfibre.com/Home.html,100 Mile House,51.6427778,-121.2955556,"Sarver Wood Fibre, 11 - Agriculture, forestry, fishing and hunting",Cariboo,Private Company,"11 - Agriculture, forestry, fishing and hunting",2007,
Sasquatch Crossing Eco Lodge,"A 111 year old, 9 room heritage home B&B located on Sts'ailes traditional lands which also offers meeting rooms for groups and advance notice catering options. We can also provide add on First Nation experiences such as cedar weaving, drum making, medicine walks, dance/drum groups etc.  ",http://www.sasquatchcrossing.ca/,Agassiz,49.2817917,-121.9475174,"Sasquatch Crossing Eco Lodge, 72 - Accommodation and food services",Lower Mainland / Southwest,Community Owned,72 - Accommodation and food services,2009,1 to 4
Sasquatch Drums,"Voice Of The Drum work shop, drum making and teachings if the drum . Ready made drum kits , all sizes and colours from baby size drums to large round floor drums.  ",,Agassiz,49.2953751,-121.9084834,"Sasquatch Drums, 71 - Arts, entertainment and recreation",Lower Mainland / Southwest,Private Company,"71 - Arts, entertainment and recreation",1995,
Sasquatch Forest Products LP,Manages three forest licenses for Stsailes  ,,Agassiz,49.2973308,-121.9119884,"Sasquatch Forest Products LP, 11 - Agriculture, forestry, fishing and hunting",Lower Mainland / Southwest,Community Owned,"11 - Agriculture, forestry, fishing and hunting",,
Sasquatch Tours and Cultural Presentations,"75 minute tour includes Stsailes Cultural Experience Guide on board.  You will witness a Stsailes Traditional Welcome, cultural interpretation of cultural sites, pictographs, transformer sites, and history on Xaxa Temexw (sacred earth).  ",http://www.sasquatchcrossing.ca/location/things-to-do/boat-tours/,Agassiz,49.2953751,-121.9084834,"Sasquatch Tours and Cultural Presentations, 71 - Arts, entertainment and recreation",Lower Mainland / Southwest,,"71 - Arts, entertainment and recreation",,
Sassie,Security services for mining camps or events.,,Vancouver,49.2611112,-123.1138889,"Sassie, 51 - Information and cultural industries",Lower Mainland / Southwest,Private Company,51 - Information and cultural industries,,
Saulteau Camp Services,"Saulteau Camp Services provides accommodation, food services and housekeeping for mining camps in the area.",http://www.saulteau.com/economic-development/economic-development-overview/,Moberly Lake,55.8333334,-121.7333333,"Saulteau Camp Services, 21 - Mining, quarrying, and oil and gas extraction",Northeast,Partnership,"21 - Mining, quarrying, and oil and gas extraction",,
Saysutshun Newcastle Island,,http://newcastleisland.ca,Nanaimo,50.1487464,-127.869873,"Saysutshun Newcastle Island, 71 - Arts, entertainment and recreation",Vancouver Island / Coast,,"71 - Arts, entertainment and recreation",,
"Schell & Associates, CPA","Provides assurance, accounting, taxation, financial and consulting services.",http://www.schellandassociatescga.ca,Victoria,48.4406339,-123.3657027,"Schell & Associates, CPA, 54 - Professional, scientific and technical services",Vancouver Island / Coast,Private Company,"54 - Professional, scientific and technical services",,5 to 9
SCS Diamond Drilling ,"SCS Drilling is a diamond drilling company that holds its core assets in providing best value and best service for todays diamond drilling jobs. Using industry leading diamond drills, drilling equipment, diamond drillers, and management we achieve maximum core drilling production at very competitive rates. We accomplish and maintain industry leading diamond drill safety awareness programs and achievements within all levels of our drilling company.",http://www.scsdrilling.com,Kamloops,50.6758334,-120.3394444,"SCS Diamond Drilling , 21 - Mining, quarrying, and oil and gas extraction",Thompson / Okanagan,Private Company,"21 - Mining, quarrying, and oil and gas extraction",,
Sea Shanty Restaurant,Sea Shanty Restaurant overlooks the ocean and boasts a great menu.,http://www.himwitsa.com,Tofino,49.1535327,-125.9091775,"Sea Shanty Restaurant, 72 - Accommodation and food services",Vancouver Island / Coast,Private Company,72 - Accommodation and food services,1991,20 to 49
Sea Wolf Adventures,"Sea Wolf Adventures connects travellers to destinations in the Broughton Archipelago and surrounding areas for sightseeing, bear viewing, water taxi services, local First Nations cultural tours, and charters. Safe. True. Educational.",http://seawolfadventures.ca/,Telegraph Cove,50.54918984,-126.8323517,"Sea Wolf Adventures, 71 - Arts, entertainment and recreation",Vancouver Island / Coast,,"71 - Arts, entertainment and recreation",,
Seabird Island Dental Centre,"The Seabird Island Dental Centre is staffed by four Dentists and nine general dental staff.    Services Available:    General dentistry, including check-ups  Cleanings  Fluoride treatments  Digital x-rays  Extractions  Root canals  Dentures and partial dentures  Crowns and bridges  Oral cancer screening  Specialist referrals  Walk-in clinics Tuesdays afternoons, starting at 1:00pm  Support network with referrals to services and programs available to our clients",http://www.seabirdisland.ca/index.php/service/dental-clinic/,Agassiz,49.2551356,-121.7303402,"Seabird Island Dental Centre, 62 - Health care and social assistance",Lower Mainland / Southwest,Community Owned,62 - Health care and social assistance,,
Seabird Island Doctors,"The Seabird Island Doctors Office offers First Nations and non-First Nations easily accessible, quality health care. Seabird Island is proud to employ two First Nations Doctors.    Services provided include:    General family doctor appointments  Diabetic Labs provided by the BC Biomedical Laboratories  Blood pressure check-ups  Physicals and mammogram clinics  Walk-in Clinics on Tuesdays after 1:00pm  Support network with referrals to services and programs available to our clients",http://www.seabirdisland.ca/index.php/service/doctors-clinic-medical-center/,Agassiz,49.2530686,-121.7312901,"Seabird Island Doctors, 62 - Health care and social assistance",Lower Mainland / Southwest,Community Owned,62 - Health care and social assistance,,
Seabird Island Driving School,Teach people how to drive. Prepare them for their Class 7 or 5 Driver's license. Safe driving skills.,http://www.seabirdisland.ca/,Agassiz,49.255185,-121.730362,"Seabird Island Driving School, 61 - Educational services",Lower Mainland / Southwest,Community Owned,61 - Educational services,,
Seabird Island Ecostation,Recycling and composting,http://www.seabirdisland.ca/index.php/2013/04/eco-station-grand-opening/,Agassiz,49.2551356,-121.7303402,"Seabird Island Ecostation, 81 - Other services (except public administration)",Lower Mainland / Southwest,Community Owned,81 - Other services (except public administration),,
Seabird Island Gravel Operations,Gravel Pit.,,Agassiz,49.2551356,-121.7303402,"Seabird Island Gravel Operations, 23 - Construction",Lower Mainland / Southwest,Community Owned,23 - Construction,,
Seabird Island Hazelnut Orchard,Hazelnut Orchard.,,Agassiz,49.2551356,-121.7303402,"Seabird Island Hazelnut Orchard, 11 - Agriculture, forestry, fishing and hunting",Lower Mainland / Southwest,,"11 - Agriculture, forestry, fishing and hunting",1989,
Seabird Solar,"Seabird Solar sells and installs high quality solar energy water heater panels, Solar Water Heaters & Solar Water Pumps, Do it yourself (DIY) solar hot water system kits and Swimming pool solar panels.    All solar thermal collectors offered utilize high efficiency evacuated tubes. Vacuum tube solar thermal collectors work well even on partially cloudy days and in cold climates.",http://www.seabirdsolar.com,Agassiz ,49.2534612,-121.7304692,"Seabird Solar, 41 - Wholesale trade",Lower Mainland / Southwest,Private Company,41 - Wholesale trade,2000,5 to 9
Seabreeze,Food truck serving fast fresh homemade food.,,Campbell River,50.0394751,-125.2475719,"Seabreeze, 72 - Accommodation and food services",Vancouver Island / Coast,Private Company,72 - Accommodation and food services,2012,
Seacret Direct with Alciia ,"Skin care products with dead sea minerals to help the skin heal, eczema, wrinkles and more!",https://www.seacretdirect.com/aliciajohn/en/us/,Kamloops,50.6758334,-120.3394444,"Seacret Direct with Alciia , 44-45 - Retail trade",Thompson / Okanagan,Private Company,44-45 - Retail trade,2013,1 to 4
Seamaster's Restaurant,Come enjoy a seafood feast of fish and shellfish accompanied by a fabulous view of Douglas Channel ,,Kitimat,53.9716357,-128.6496716,"Seamaster's Restaurant, 72 - Accommodation and food services",North Coast,Private Company,72 - Accommodation and food services,,
Secluded Wellness Centre,"Holistic Health and wellness centre offering a variety of alternative health services including: iridology, lifestyle consultations, Nature's Sunshine Products, workshops and hotstone, reiki, shiatsu massage",http://www.secludedwellness.com/,Port Alberni,49.2667771,-124.8492185,"Secluded Wellness Centre, 62 - Health care and social assistance",Vancouver Island / Coast,Private Company,62 - Health care and social assistance,2011,1 to 4
Second Pass Forestry Ltd.,"Second Pass Forestry Ltd. is a 100% First Nation owned and operated company that commits to pursue and provide a diversity of quality work/consultation in all Natural Resource and Cultural sectors throughout the BC Southern Interior to support Fist Nations communities, government and industry clients while maintaining high industry standards for safety.  Our company objective is to build professional experience and knowledge and to address the lack of capacity related to natural resource management within local First Nation communities and to address the lack of capacity. We specialize in multi-phase forest management/development.     Our mandate is to hire local First Nations who are currently studying or have graduated from Natural Resource related programs (certificate, diploma or degree) to develop skills and knowledge and provide training and mentoring to increase success of job seekers and employee retention.    Our Company provides multi and full phase forest and land management with a roughly 10 years of direct and indirect forest related experience as well as various forest engineering and development courses and training. Experience in forest planning, road and cut block layout, timber cruising, through to submitted cutting permits for forest licensees and perform archaeology work for First Nations. In addition, our company consists of a certified Canada Safety Council- Defensive Driving Course instructor, and two S-100 Basic Fire Suppression Instructor to help with safety training initiatives.    Specific Company details include:  - To build professional experience and knowledge within local First Nations (FN) Communities  - To address the lack of capacity within most First Nation communities related to Natural Resource management and operational experience  - Increase local community expertise and knowledge  - To hire band members who are currently studying in or have graduated from a Natural Resource related program (certificate, diploma or degree)    - Develop Skills and knowledge  - Provide training to increase success of job seeking and retention  - S-100 training  - Archaeology training (RISC course)  - Defensive driving training    - To develop negotiation skills for resource opportunities and discussions  - Meet with and learn from existing First Nations that have successful Comprehensive Community Plans and regional agreements/ Memorandum of Understanding (MOU's) etc.  ",http://www.spfl.ca/,Kamloops,50.64588,-120.365409,"Second Pass Forestry Ltd., 11 - Agriculture, forestry, fishing and hunting",Thompson / Okanagan,,"11 - Agriculture, forestry, fishing and hunting",2015,
Secret Beach Campground,"The Secret Beach campground was built in 2013 and features 67 campsites, a kayak launch, and overnight parking. ",http://www.coastandkayak.com/secretbeach/index.html,Ucluelet,48.9447204,-125.5565291,"Secret Beach Campground, 72 - Accommodation and food services",Vancouver Island / Coast,Community Owned,72 - Accommodation and food services,2013,
Secwepmc Museum & Heritage Park,"The Secwepemc Museum displays incorporate the oral history and legends of the Secwepemc people, along with historical photographs, illustrations and artifacts.",http://www.secwepemcmuseum.com,Kamloops,50.6805707,-120.2984508,"Secwepmc Museum & Heritage Park, 71 - Arts, entertainment and recreation",Thompson / Okanagan,Community Owned,"71 - Arts, entertainment and recreation",,
Senkulmen Business Park,"A 112 acre environmentally sustainable business and light industrial park for the South Okanagan featuring a new border crossing at Osoyoos, superb highway linkages to Vancouver and the interior, high environmental standards, parkland reserves and stringent design guidelines.    First Phase now open for leasing.  ",http://www.senkulmen.ca,Oliver,49.1708801,-119.5567448,"Senkulmen Business Park, 53 - Real estate and rental and leasing",Thompson / Okanagan,Joint Venture,53 - Real estate and rental and leasing,,
