Business Name,Description,Web Site,City,Latitude,Longitude,Keywords,Region,Type,Industry Sector,Year Formed,Number of Employees
dk Architecture Inc.,"dk Architecture Inc. is a socially responsible, First Nation architecture firm that provides full architectural services for projects of varying types and scales specializing in First Nations architecture.  dk Architecture is client services orientated and takes a holistic approach to design. This ensures that client concerns are clearly translated into the project without compromise.    With 25 years of professional experience Dave Kitazaki is respected by all the First Nations he has worked with.    Consulting - Professional Architecture Services for varying types of commercial projects: Mixed-use, commercial, Multi-unit residential, Cultural Centers, Schools, Health Centers, Community Buildings, Band Offices, Veterinary Clinics, Civic, and Residential.",,North Vancouver,49.3233871,-123.1213683,"dk Architecture Inc., 54 - Professional, scientific and technical services",Lower Mainland / Southwest,Private Company,"54 - Professional, scientific and technical services",2014,1 to 4
DK Helicropper Int'l Ltd. ,"DK Helicropper Int'l Ltd. is a helicopter charter service provider, as well as a aerial seed harvesting company.    At Helicropper, we have acquired a diversified blend of helicopters which allows us to provide you with the perfect match of aircraft to job demand. With our SAFE certification and full Safety Management System, we are able to assess and reduce the risk and hazards that come with the demand of this industry. We are dedicated to providing the most safe, reliable and efficient helicopter service out there that translates into less man days, and more money left in the customers pocket.",http://www.helicropper.com/,Abbotsford,49.1474523,-122.4354597,"DK Helicropper Int'l Ltd. , 48-49 - Transportation and warehousing",Lower Mainland / Southwest,Private Company,48-49 - Transportation and warehousing,,10 to 19
DKGL Excavating,"Excavating, road building, land clearing, landscaping, gravel pit work.  ",,Kispiox,55.3586778,-127.6873256,"DKGL Excavating, 23 - Construction",North Coast,,23 - Construction,,1 to 4
DL Safety Consulting,"DL Safety provides traffic control services, traffic control training, traffic control planning, Worksafe BC First Aid Industrial & Occupational Health and Safety Consulting, Red Cross Courses & Food Safe ",http://dlsafetyconsulting.ca/home2,Burnaby,49.2253296,-122.9385925,"DL Safety Consulting, 81 - Other services (except public administration)",Lower Mainland / Southwest,Private Company,81 - Other services (except public administration),,
DNL Contracting,,,Lillooet,50.6752786,-121.9341065,"DNL Contracting, 23 - Construction",Lower Mainland / Southwest,,23 - Construction,,
Dockside Smoked Fish Store,"The Dockside Fish store in Tofino specializes in three different types of salmon, which is fresh, smoked or canned. This is caught locally by local fishermen, and is then smoked by local smoke masters who has been smoking fish for over 20 years.",http://www.himwitsa.com/smoked-fish-store-tofino-seafood-market-smoked-canned-salmon-seafood-wholesalers-tofino-bc.htm,Tofino,49.1530556,-125.9044444,"Dockside Smoked Fish Store, 41 - Wholesale trade",Vancouver Island / Coast,Private Company,41 - Wholesale trade,,
Doig River Energy Ltd.,"An oilfield service company, with a mission is to provide oil field services that will help customers produce oil and gas more efficiently through sustainable environmental practice.",,Fort St John,56.2525,-120.8466667,"Doig River Energy Ltd., 21 - Mining, quarrying, and oil and gas extraction",Northeast,Community Owned,"21 - Mining, quarrying, and oil and gas extraction",,
Doig River Timber,"Doig River Timber (DRT) LLP is owned by Doig River First Nation. The company was established in 2005 as a result of a Memorandum of Agreement with Canfor Louisance Pacific for the harvest of 80,000 m3 of Fibres for the Local OSB Plant in Fort St. John.     DRTs primary business activities are timber harvesting and processing. DRT was developed to facilitate long-term and full-time employment for First Nations. One of the steps DRT has taken to achieve this is to acquire a long-term harvest contract with Canfor under a Memorandum of Understanding (MOU).     While providing full-time employment, DRT will also provide an avenue to increase the capacity of First Nations people through training and mentorship. DRT will also ensure profitable logging practices, protect the environment, practise sustainable forestry and protect Aboriginal and treaty rights.     We have established a solid reputation for harvesting, logging, and conducting operations in a safe responsible manner",,Rose Prairie,56.5,-120.7833333,"Doig River Timber, 11 - Agriculture, forestry, fishing and hunting",Northeast,Community Owned,"11 - Agriculture, forestry, fishing and hunting",2005,
"Domcor Health, Safety & Security Inc.","We are a premier provider of fully integrated Health and Safety Services, including First Aid, Traffic Control and Security solutions throughout Canada.    We offer community-based training in all aspects of a health and safety program, delivered locally or globally. We work your hours, at your location and convenience. Domcor brings its proven industrial training programs, including first aid training and confined space training, to wherever you are in the world, right here from Canada",http://www.domcor.ca/,Campbell River,50.0276457,-125.2484805,"Domcor Health, Safety & Security Inc., 54 - Professional, scientific and technical services",Vancouver Island / Coast,Private Company,"54 - Professional, scientific and technical services",1999,
Dominion Aggregates,"Heavy equipment, Earth moving, civil underground work, gravel crushing, gravel supply, logging, trucking, lowbedding, road building",,Invermere,50.5058334,-116.0305555,"Dominion Aggregates, 23 - Construction",Kootenay,,23 - Construction,1985,
Dominion Excavating Ltd ,"Heavy equipment, Earth moving, civil underground work, gravel crushing, gravel supply, logging, trucking, lowbedding, road building ",,Invermere,50.5058334,-116.0305555,"Dominion Excavating Ltd , 23 - Construction",Kootenay,Private Company,23 - Construction,1985,
Donald A Cook Contracting,Fencing company,,Enderby,50.5503102,-119.1346113,"Donald A Cook Contracting, 23 - Construction",Thompson / Okanagan,,23 - Construction,,
Doolan Trucking, Steven Doolan provides short and long haul log transportation,,Ginglox,54.9964447,-129.952372,"Doolan Trucking, 48-49 - Transportation and warehousing",North Coast,Private Company,48-49 - Transportation and warehousing,2013,1 to 4
Douglas Communications Inc. ,"Management Consulting specializing in Communication/HR research and measurement. Research design & analysis and consulting advice on employee perceptions of the workplace experience (including employee engagement, HR programs/practices, communication audit, etc).  ",http://www.dcom.ca,Maple Ridge,49.2094197,-122.5657254,"Douglas Communications Inc. , 54 - Professional, scientific and technical services",Lower Mainland / Southwest,Private Company,"54 - Professional, scientific and technical services",2001,1 to 4
Drake Forestry Services Ltd.,"Drake Forestry Consortium is a Kelowna based consulting firm that provides technical and professional services to government and industry, large or small in many aspects of forest management along with an expanded GIS department capable of a full range of services including mapping, analysis, cartography, remote sensing just to name a few. Contact us for your project needs.",http://www.drakeforestry.com/drakeforestry/,Kelowna,49.8803335,-119.5281435,"Drake Forestry Services Ltd., 54 - Professional, scientific and technical services",Thompson / Okanagan,Private Company,"54 - Professional, scientific and technical services",,5 to 9
Dreamcatcher Business Solutions,"Dreamcatcher Business Solutions engages in business consulting from strategic planning, business planning, marketing design, marketing strategy, brand development and feasibility studies.",http://www.dcbsolutions.com,Cobble Hill,48.6828776,-123.5625795,"Dreamcatcher Business Solutions, 54 - Professional, scientific and technical services",Vancouver Island / Coast,Private Company,"54 - Professional, scientific and technical services",,
Dreamweaver's Trading,"Traditional Cedar basket supplies, contemporary and traditional clothing and design, star blankets etc, baby wear, professional driver licence Class 1, facilitator for personal development.",,Mount Currie,50.3166667,-122.7166667,"Dreamweaver's Trading, 44-45 - Retail trade",Lower Mainland / Southwest,Private Company,44-45 - Retail trade,2008,1 to 4
Dunedin River Contracting,"Slashing, Clearing, Oilfield Maintenance",,Fort Nelson,58.8055556,-122.6972222,"Dunedin River Contracting, 23 - Construction",Northeast,Private Company,23 - Construction,,
Duraglas Composites,"Duraglas Composites supplies fiberglass grave liners and cremation vaults, offering a low cost, easy to use and maintenance free product for burial purposes. ",http://duraglascomposites.com/,West Kelowna,49.8713178,-119.5398082,"Duraglas Composites, 31-33 - Manufacturing",Thompson / Okanagan,Private Company,31-33 - Manufacturing,,
Duz Cho Construction,,http://www.duzcho.com/,Chetwynd,55.6962345,-121.6213081,"Duz Cho Construction, 23 - Construction",Northeast,Community Owned,23 - Construction,2002,
Duz Cho Construction LP,"Duz Cho Construction is an earthworks construction company doing site development, road access, and reclamation for the oil and gas, wind energy, mining and other civil works construction within the traditional territory of McLeod Lake Indian Band.",https://duzcho.com/duz-cho-construction/,Chetwynd,55.6963381,-121.6266684,Duz Cho Construction LP  23 – Construction,Northeast,Community Owned Company,23 – Construction,2002,55 to 99
Duz Cho Logging,"Duz Cho Logging Limited Partnership is a well established full phase harvesting and road construction contractor operating since 1988. The name Duz Cho is Tsekhene meaning big wood. Duz Cho is an incorporated company 100percent owned by the McLeod Lake Indian Band and operates primarily in the areas of McLeod Lake and Williston Lake Reservoir in North Central British Columbia including McLeod Lake Indian Bands settlement lands.    Based out of McLeod Lake and Mackenzie, Duz Cho Logging began operations with an initial contract to log approximately 60,000 cubic metres of timber in the Mackenzie area. Over time Duz Chos reputation as a premier harvesting contractor with strong values of quality, integrity and safety has become solidified in the region. Duz Cho Logging now harvests from 800,000 to 1 million cubic meters per year.    Although Duz Cho Loggings past success has been based largely in timber harvesting, log hauling and road construction we recognize that the continued success of the company will depend on the diversification of the business. To this end Duz Cho Logging has diversified into gas, oil and mining sectors while maintaining the core harvesting operations.",http://www.duzchologging.com/,Mackenzie,55.3122231,-123.1407469,"Duz Cho Logging, 11 - Agriculture, forestry, fishing and hunting",Cariboo,Community Owned,"11 - Agriculture, forestry, fishing and hunting",1988,
Dwayne Malloway ,"Wood carvings, antler carvings, drums, paintingsof  all traditional style  ",,Chilliwack,49.1131596,-121.9440463,"Dwayne Malloway , 44-45 - Retail trade",Lower Mainland / Southwest,Partnership,44-45 - Retail trade,2005,1 to 4
Dynamic Online Marketing Corp,Dynamic Online Marketing Corp. provides Management Consulting Services. ,,Surrey,49.1947978,-122.8060404,"Dynamic Online Marketing Corp, 54 - Professional, scientific and technical services",Lower Mainland / Southwest,,"54 - Professional, scientific and technical services",,
Dynamic Tree Services,"Dynamic Tree Services is a family owned and operated business, with over 25 years of experience. We provide high quality tree maintenance for residential and commercial properties at competitive prices in the Lower Mainland and Southwest.",http://www.dynamictreeservices.com,Burnaby,49.2711403,-123.0077429,"Dynamic Tree Services 11 – Agriculture, forestry, fishing and hunting",Lower Mainland / Southwest,Private Company,"11 – Agriculture, forestry, fishing and hunting",2012,1 to 4
E & K Construction,"Vegetation Management, slashing and herbicide, fishery and renovations. Trucks, boats, atv, quads, backhoe, forklifts and chainsaw excavators, Bucket, chippers",,Hope,49.38,-121.4413889,"E & K Construction, 23 - Construction",Lower Mainland / Southwest,Private Company,23 - Construction,,10 to 19
Eagle Auto Wrecking and Khowutzun Auto Recycling Sales,Auto wrecking and recycling of used vehicles,,Duncan,48.775769,-123.709803,"Eagle Auto Wrecking and Khowutzun Auto Recycling Sales, 81 - Other services (except public administration)",Vancouver Island / Coast,Private Company,81 - Other services (except public administration),,1 to 4
Eagle Claw Contracting,Willing to travel to work.  ,,Riske Creek,51.9686111,-122.5283333,"Eagle Claw Contracting, 23 - Construction",Cariboo,,23 - Construction,,1 to 4
Eagle Home Inspection,"Eagle Home Inspection provides professional, ethical and quality-conscious Home Inspection services to the Okanagan community. Our goal is to make the inspection process a worry-free experience, where clear and concise information is shared. We focus on recently built or previously owned homes, town homes and condominiums. We provide a fair evaluation of the condition of the home prior to selling or determine if there are any issues with the home prior to purchasing. We offer general maintenance inspections of homes. This enables you to determine if there are any potential problems that might be present but undetected, or areas of your home that might need to be monitored, for future issues.",http://eagleinpection.ca/,West Kelowna,49.8633609,-119.6127349,"Eagle Home Inspection, 54 – Professional, scientific and technical services",Thompson / Okanagan,Private Company,"54 - Professional, scientific and technical services",2016,1 to 4
Eagle Landing Development Limited Partnership,"A retail village anchored by Wal-Mart (opened November 2010), Home Depot (opening April 2011) and Cineplex/Galaxy Theatres (opened November 2010). Upon full completion and build-out in 2013 Eagle Landing will be the dominant retailing centre with 33 businesses currently in operation, and growing!  ",,Chilliwack,49.1575792,-121.9800912,"Eagle Landing Development Limited Partnership, 55 - Management of companies and enterprises",Lower Mainland / Southwest,Development Corporation,55 - Management of companies and enterprises,2010,
Eagle Rock Materials Ltd.,"This joint venture comprises a construction aggregate quarry located near Port Alberni and a series of receiving   marine terminals in California, the target market for the company's products.",,Port Alberni,49.2344445,-124.8058333,"Eagle Rock Materials Ltd., ",Vancouver Island / Coast,Joint Venture,,2001,
Eagleeye Pictures,Professional Photography,,Port Alberni,49.2467253,-124.7977823,"Eagleeye Pictures, 71 - Arts, entertainment and recreation",Vancouver Island / Coast,Private Company,"71 - Arts, entertainment and recreation",1989,1 to 4
Earthline Contemporary Aboriginal Designs & Accessories,"Aboriginal contemporary designed clothing and accessories including purses, wedding and formal apparel, office wear and casual attire. ",,Lower Nicola,50.1766152,-120.8669725,"Earthline Contemporary Aboriginal Designs & Accessories, 44-45 - Retail trade",Thompson / Okanagan,Private Company,44-45 - Retail trade,,1 to 4
Edzerza Gallery,"Original First Nations designs, clothing, carvings.",http://www.edzerzagallery.com/,Vancouver ,49.2611112,-123.1138889,"Edzerza Gallery, 44-45 - Retail trade",Lower Mainland / Southwest,Private Company,44-45 - Retail trade,2003,1 to 4
Edziza Contracting Ltd.,Slashing / Falling / Helipad building/ Drill pad building / Seismic line cutting and general labour ,,Terrace,54.5031485,-128.5870657,"Edziza Contracting Ltd., 21 - Mining, quarrying, and oil and gas extraction",North Coast,Private Company,"21 - Mining, quarrying, and oil and gas extraction",2009,20 to 49
Eensa Contracting Ltd.,"Oilfield labour, pipeline labour, Seismic slashing, Hotshot, General oilfield services, and Traffic Control.",,Fort Nelson,58.8055556,-122.6972222,"Eensa Contracting Ltd., 21 - Mining, quarrying, and oil and gas extraction",Northeast,Private Company,"21 - Mining, quarrying, and oil and gas extraction",,
Eh-Cho-Dene Enterprises,"Heavy equipment, lease and road construction and maintenance, seismic cutting, excavations, slashing crews, gravel crushing and supply pit run.     Equipment includes: 200+ pieces of heavy equipment, such as CATS, graders, loaders, back hoes and rock trucks; fully licensed operators and mechanics. ",http://www.ehchodene.com/,Fort Nelson,58.8043923,-122.7390938,"Eh-Cho-Dene Enterprises, 23 - Construction",Northeast,Community Owned,23 - Construction,1983,20 to 49
Ekoolthaht Marine Corporation,Fishing and Lease Boats,,Port Alberni,49.2667771,-124.8492185,"Ekoolthaht Marine Corporation, 11 - Agriculture, forestry, fishing and hunting",Vancouver Island / Coast,Community Owned,"11 - Agriculture, forestry, fishing and hunting",2010,1 to 4
Elaine Alec Consulting,"Elaine Alec offers services including: Implementing Indigenous Knowledge, Strategic Planning, Community Planning, Communication Strategies, Mediator, Facilitator, Speaker, Technical Writer, Proposal Development, Research, Public Relations, Small Business Creation, Project Management, Target Marketing, Talent Recruitment",http://elainealec.homestead.com/,Penticon,49.491331,-119.644963,"Elaine Alec Consulting, 54 - Professional, scientific and technical services",Thompson / Okanagan,Private Company,"54 - Professional, scientific and technical services",,
Eleven 22 Grill & Liquids,"Original, modern, comfort cuisine is the hallmark of ELEVEN22. Chef/owner Konan Mars passion for the culinary arts is displayed in his dishes, which reflect his creative talent and diversity.",http://www.eleven22.ca/index.htm,Golden,51.2940449,-116.9629507,"Eleven 22 Grill & Liquids, 72 - Accommodation and food services",Thompson / Okanagan,Private Company,72 - Accommodation and food services,,
Ellis Excavating Ltd,"Excavating company, road building, subdivisions, excavations, underground utilities, site development, sewer, water, rock breaking",,Nanaimo,49.2203405,-124.0111353,"Ellis Excavating Ltd, 23 - Construction",Vancouver Island / Coast,Private Company,23 - Construction,,
Em Salon and Spa,"We offer a full range of Salon & Spa services.    Haircare, Coloring  Massage Hands & Feet  Facials, Nails  Waxing For Him and Her",http://www.emsalonspa.ca,Port Alberni,49.2561138,-124.8105236,"Em Salon and Spa, 81 - Other services (except public administration)",Vancouver Island / Coast,Private Company,81 - Other services (except public administration),,
Embark Engineering,"Working with key engineering and environmental partners, Embark provides a wide range of engineering services, including infrastructure planning, design and construction, project management, and resource management to government, industry, and First Nations. ",http://www.embarkengineering.com/,Burnaby,49.259969,-123.0113595,"Embark Engineering, 54 - Professional, scientific and technical services",North Coast,Partnership,"54 - Professional, scientific and technical services",,
Emerge Wings of Change Consulting,"Business consultants, Professional development seminars, Training facilities management, Workshops",,Powell River,49.894387,-124.5996721,"Emerge Wings of Change Consulting, 54 - Professional, scientific and technical services",Vancouver Island / Coast,Private Company,"54 - Professional, scientific and technical services",,
Emory Creek Campground,"Emory Creek Campground is located in Yale, BC, 18km north of Hope, BC off the Trans Canada highway.The park is 15 hectares and is located next to the Canadian Pacific Railway mainline.The campground is open annually from May 15 to October 15 with 35 vehicle accessible campsites.Emory Creek Campground is located in Yale, BC, 18km north of Hope, BC off the Trans Canada highway.The park is 15 hectares and is located next to the Canadian Pacific Railway mainline.The campground is open annually from May 15 to October 15 with 35 vehicle accessible campsites.",http://emorycreekcampground.com,Yale,49.51361,-121.416761,"Emory Creek Campground, 72 - Accommodation and food services",Lower Mainland / Southwest,Community Owned,72 - Accommodation and food services,,
Enigma Apparel and Promotions,"Enigma Promo produces t-shirts, promotional products, large format printing, business cards and stationery. They deisgn and print signage, vehicle decals and apparel for construction sites. Their retail store also sells clothing suitable for heavy industry and they supply custom key tags for mining camps and industry.",http://www.enigmapromo.ca/,Kitimat ,54.0544068,-128.6533348,"Enigma Apparel and Promotions, 44-45 - Retail trade",North Coast,Private Company,44-45 - Retail trade,,
EnviroPro,,http://www.enviroprocanada.ca/,Burns Lake,54.2226069,-125.7467446,"EnviroPro, 56 - Administrative and support, waste management and remediation services",Nechako,Joint Venture,"56 - Administrative and support, waste management and remediation services",,
Epicure with Christine,"Catalogue sales of high quality spices and cook ware, dips and seasonings.",,Kamloops,50.6758334,-120.3394444,"Epicure with Christine, 44-45 - Retail trade",Thompson / Okanagan,Private Company,44-45 - Retail trade,2012,1 to 4
Equis Forestry Products Ltd,,,Port Alberni,49.2667771,-124.8492185,"Equis Forestry Products Ltd, 11 - Agriculture, forestry, fishing and hunting",Vancouver Island / Coast,Community Owned,"11 - Agriculture, forestry, fishing and hunting",2010,1 to 4
Erich Glendale Art,"Fine art created by Erich Glendale, Tseshaht Artist, that includes one of a kind wood carvings, gold & silver jewelry.",http://www.erichglendalecarver.com/,Port Alberni,49.2718552,-124.8609426,"Erich Glendale Art, 71 - Arts, entertainment and recreation",Vancouver Island / Coast,Private Company,"71 - Arts, entertainment and recreation",,1 to 4
Eri-Cut & Nailed,"Eri-Cut & Nailed is a one-stop salon providing manicure, pedicure and haircutting services to the residents of Haida Gwaii.",https://www.facebook.com/pages/Eri-Cut-Nailed/159522787403394,Skidegate,53.2666667,-131.9902778,"Eri-Cut & Nailed, 81 - Other services (except public administration)",North Coast,Private Company,81 - Other services (except public administration),,
Esh-kn-am Investments Joint Venture,,http://www.eshknam.com,Spences Bridge,50.4225717,-121.3437443,"Esh-kn-am Investments Joint Venture, 55 - Management of companies and enterprises",Thompson / Okanagan,Community Owned,55 - Management of companies and enterprises,1997,10 to 19
Etched in time ,"Laser engraved products and services. We engrave signs, wood, coasters and much more. ",,Lilooet,50.689439,-121.9532452,"Etched in time , 54 - Professional, scientific and technical services",Lower Mainland / Southwest,Private Company,"54 - Professional, scientific and technical services",2011,1 to 4
Etzerza Contracting ,"Excavating and gravel truck services in Telegraph Creek, BC",,Telegraph Creek,57.9,-131.1666667,"Etzerza Contracting , 23 - Construction",North Coast,Private Company,23 - Construction,,
Eustache Consulting,,http://www.simpcw.com/,Barriere,51.1797223,-120.1236111,"Eustache Consulting, 54 - Professional, scientific and technical services",Thompson / Okanagan,Community Owned,"54 - Professional, scientific and technical services",,
Evedar's Bistro,Restaurant,http://evedarsbistro.com,Langford,48.4483167,-123.5012052,"Evedar's Bistro, 72 - Accommodation and food services",Vancouver Island / Coast,Private Company,72 - Accommodation and food services,,5 to 9
F&A Earthmoving Ltd,A family owned gravel truck and excavating company. Also have a logging truck. ,,Mission,49.1591667,-122.2838889,"F&A Earthmoving Ltd, 48-49 - Transportation and warehousing",Lower Mainland / Southwest,Partnership,48-49 - Transportation and warehousing,1996,1 to 4
Factory Direct Furniture,"We sell solid wood furniture and mattresses. We have bedroom, living room, office, dinning room and decor. We also have foam and spring mattresses and bedding supplies. 90% of our stock is BC made.",http://www.factorydirectwilliamslake.ca/,Williams Lake,52.1407756,-122.134909,"Factory Direct Furniture, 44-45 - Retail trade",Cariboo,Private Company,44-45 - Retail trade,2011,1 to 4
Falcon Camp Services Inc.,"Falcon Camp Services is a 100% First Nations owned and operated camp and catering company. As an integrated supplier, Falcon Camp Services provides our clients with full service workforce accommodation solutions, from site construction and facility installation through to catering and camp management. No matter the location or size of your project, we specialize in bringing comfortable accommodations to permanent and temporary workforces throughout our operating area.",http://www.falconcampservices.com/,Prince George,53.8431348,-122.7287357,"Falcon Camp Services Inc., 72 - Accommodation and food services",Cariboo,Private Company,72 - Accommodation and food services,,
Fast & Corcoran,Lawyer specializing in Native/Aboriginal Law,,Coquitlam,49.3199024,-122.7940588,"Fast & Corcoran, 54 - Professional, scientific and technical services",Lower Mainland / Southwest,Private Company,"54 - Professional, scientific and technical services",1995,1 to 4
