Business Name,Description,Web Site,City,Latitude,Longitude,Keywords,Region,Type,Industry Sector,Year Formed,Number of Employees
Ellipsis Energy Inc,"Ellipsis Energy Inc is an Aboriginal owned company offering expertise in operations and maintenance on well sites and facilities. Based on Saulteau First Nation at Moberly Lake, BC, we serve all of western and northern Canada, with ability to serve U.S. and international markets, with a focus on the northwest Alberta/northeast B.C. region. Our team is dedicated to ensure the projects we are involved in are successful, meet in service dates, achieve production rates and quality and are passionate about our first nations youth training and mentoring program. We believe our people and work ethic with our experience and attention to detail is second to none. We have experience with sour gas, amine trains, sub-dewpoint/shallow cut hydrocarbon extraction facilities, sulphur plants, cryogenic deep cut facilities, oil separation, dehydration, gas compression, power generation, water treatment and water injection, steam generation, pump stations and other processes. We are consultants and project managers for decommissioning and reclamation of well sites and facilities, as well as commissioning greenfield/new construction and brownfield/expansions to existing facilities. We operate and maintain facilities and can provide professional and experienced power engineers or tradesmen/tradeswomen to meet our clients needs.",http://www.ellipsisenergy.ca,Moberly Lake ,55.8193701,-121.8346022,"Ellipsis Energy Inc 21 – Mining, quarrying, and oil and gas extraction",Northeast,Private Company,"21 – Mining, quarrying, and oil and gas extraction",2012,5 to 9
Indigenous Community Development & Prosperity (ICDPRO),ICDPRO works together with Indigenous communities to assist their leaders and members to find plausible solutions to the challenges they have identified. ICDPRO also works with non-Indigenous organizations to help facilitate effective and mutually-beneficial engagement with Indigenous communities. ICDPRO also provides professional speakers/presenters/facilitators for all sizes of organizations in all industries.,https://indigenouscommunitydevelopment.com/,Enderby,50.5514976,-119.1335465,Indigenous Community Development & Prosperity (ICDPRO) 81 – Other services (except public administration),Thompson / Okanagan,Private Company,81 – Other services (except public administration),2020,1 to 4
Formline Construction Ltd.,"With over combined 30 years of experience in the construction industry, we have formed a great team to provide value-added services to our clients. We have worked on a range of projects from building roads to industrial, commercial, and residential buildings",https://www.flcon.ca/,Burnaby,49.2660502,123.0058404,Formline Construction Ltd. 23 – Construction,Lower Mainland / Southwest,Private Company,23 – Construction,2021,1 to 4
Quilakwa Investments Ltd.,"Quilakwa Investments Ltd. oversees several Indigenous-owned and operated businesses in the traditional territory of the Splatsin Indian Band: Quilakwa Centre, home to Quilakwa Esso, a full-service gas station, 2-bay car wash, Tim Horton's, and large parking area,  Quilakwa RV Park, a family-friendly campground just over the bridge in Enderby, adjacent to the Shuswap River, Quilakwa-at-the-Lake, a brand new campsite located just above the Rivermouth at Mabel Lake, The Shack, your home-base for river tubing in Enderby, located right by the hand-launch in downtown Enderby, offering snacks, drinks, ice cream, and tubing supplies!",http://www.splatsindc.com,Enderby,50.5375073,-119.141955,Quilakwa Investments Ltd.,Thompson / Okanagan,Community Owned Company,72 – Accommodation and food services,1984,20 to 49
Quilakwa Esso,"Quilakwa Esso is owned by the Splatsin Indian Band. We provide full-service gas, diesel, propane, car wash, electric vehicle fast chargers, Native arts & crafts, fireworks, ice, snacks, drinks, and more! Tim Horton's is also on site!",,Enderby,50.5375073,-119.141955,Quilakwa Esso 44-45 - Retail trade,Thompson / Okanagan,Community Owned Company,44-45 - Retail trade,1984,10 to 19
Quilakwa RV Park,"Welcome to Quilakwa RV Park. This fun, family-friendly RV Park is just across the bridge from downtown in Enderby, BC. Year-round camping, with full-hookups and tenting sites! Close to the Shuswap River for swimming, tubing, and kayaking. Quilakwa RV Park is located along the banks of the beautiful Shuswap River in the heart of Enderby, BC. The RV Park is calm and serene with groomed lawn and grassed sites. The Enderby Cliffs provide a majestic backdrop and there are numerous golf courses and hiking trails close by. Located along the banks of the beautiful Shuswap River in the heart of Enderby, BC. Quilakwa RV Park is equipped with pull-through sites, electrical outlets, picnic tables, water, toilets, free hot showers, laundry facilities, and a convenience store. Firewood, ice, and other items are available. Pets are welcome. A fenced-in off-leash area for your dog's pleasure is provided. Close, easy access to many area amenities, including: hiking, boating, drive-in theatre, First Nations culture, and more.", http://www.quilakwarvpark.ca,Enderby,50.5514976,-119.1335465,Quilakwa RV Park 72 – Accommodation and food services,Thompson / Okanagan,,72 – Accommodation and food services,1984,1 to 4
Quilakwa at the Lake Campground,"Quilakwa at the Lake Campground is that, and nothing more – camping at the lake. There is no power, water, or even cell service. But what you ARE getting is a beautiful campsite by Mabel Lake – an absolute gem in the North Okanagan, Our camp host may offer firewood, water, or other supplies for sale at times. There are stores located by each of the local marinas, offering items such as ice, snacks, drinks, and other supplies. We also offer boat trailer parking for those looking to get on the water. Campsites are unserviced, but large enough to accommodate most sizes of trailers and RV’s, Each campsites is equipped with a picnic table and fire ring, and the campground has toilets and garbage disposal on site. There is a trail that leads to down to the lake, marina, boat launch, and beach. Lots of room for the kids to play. Pets permitted, must be on leash at all times. You are here in the heart of the Mabel Lake resort area – marinas, beaches, hiking, biking, and even a golf course within walking distance – and of course beautiful MABEL LAKE!",http://www.quilakwarvpark.ca,Enderby,50.6024166,-118.7306577,Quilakwa at the Lake Campground 72 – Accommodation and food services,Thompson / Okanagan,,72 – Accommodation and food services,2021,1 to 4
Quilakwa Snack Shack,"The little hut is open every Summer for all your river tubing needs. Tubes and floaties, air, ice, snacks, drinks, ice cream, and more! Open daily from May to September.",,Enderby,50.5495973,-119.1398143,Quilakwa Snack Shack 44-45 Retail trade,Thompson / Okanagan,,44-45 - Retail trade,2021,1 to 4
dk Architecture,"dk Architecture Inc. is a socially responsible, First Nation architecture firm that provides full architectural services for projects of varying types and scales specializing in First Nations architecture. dk Architecture is client services orientated and takes a holistic approach to design. This ensures that client concerns are clearly translated into the project without compromise. With 25 years of professional experience Dave Kitazaki is respected by all the First Nations he has worked with. Consulting – Professional Architecture Services for varying types of commercial projects: Mixed-use, commercial, Multi-unit residential, Cultural Centers, Schools, Health Centers, Community Buildings, Band Offices, Veterinary Clinics, Civic, and Residential.",http://dkarchitecture.ca,North Vancouver,49.3234992,-123.1229699,"dk Architecture 54 – Professional, scientific and technical services",Lower Mainland / Southwest,Private Company,"54 – Professional, scientific and technical services",2014,1 to 4
Uujo Contracting Limited Partnership,"Uujo Contracting Limited Partnership is a Doig River First Nation-owned contracting firm based out of the Rose Prairie area. Uujo Contracting LP has been in business for over 15 years with over 30 years experience in road maintenance and construction. The firm is committed to being a safe, reliable, quality-driven and cost-effective provider of road maintenance and construction services. It ensures to continually strive to improve performance in meeting the needs of its clients, shareholders, employees and communities. Uujo Contracting LP offers a variety of contracting services and heavy machinery for projects in the area.",,Rose Prairie,56.5780801,-120.4982582,Uujo Contracting Limited Partnership 23 – Construction,Northeast,Community Owned Company,23 – Construction,2007,10 to 19
Shop First Nations,"Shop First Nations (SFN) is an Indigenous-owned and led startup seeking to enable Reconciliation through impactful consumer purchasing, e-commerce and digital marketing, and education initiatives. We support First Nations, Inuit, and Métis businesses by encouraging consumers to purchase Indigenous products and services as an act of economic reconciliation. Finally, through our team’s technology experience and Indigenous perspective, we also work with non-Indigenous tech organizations to help bring Cultural Safety awareness to BC’s tech sector.",https://shopfirstnations.com/,New Westminster,49.2000155,-122.9139201,"Shop First Nations  54 – Professional, scientific and technical services",Lower Mainland / Southwest,Private Company,"54 – Professional, scientific and technical services",2020,1 to 4
Kleekhoot Gold,Big Leaf Maple syrup producer.,https://kleekhootgold.ca/,Port Alberni,49.2660405,-124.8275668,"Kleekhoot Gold 11 – Agriculture, forestry, fishing and hunting",Vancouver Island and Coast,Community Owned Company,"11 – Agriculture, forestry, fishing and hunting",2015,5 to 9
Upnit Power,Run of the river hydroelectric power generation,,Port Alberni,49.1901565,-124.7538602,"Upnit Power Corporation, 22 - Utilities",Vancouver Island and Coast,Partnership,22 – Utilities,2004,5 to 9
Kwa'lilas Hotel,"The Kwa'lilas Hotel is located in the traditional territories of the Kwakiutl people and is a demonstration of the commitment of the Gwa'sala-'Nakwaxda'xw Nations to share our history, culture and passion for our traditional territory in a meaningful and permanent way by showcasing and celebrating it in a beautiful, comfortable space that is representative of the community.",https://kwalilashotel.ca/,Port Hardy,50.721863,-127.5028344,Kwa'lilas Hotel 72 – Accommodation and food services ,Vancouver Island and Coast,Community Owned Company,72 – Accommodation and food services ,2015,100 to 199 
Fourwinds Driving School,"The Fourwinds Driving Program is designed to develop confidence, independence along with safe & defensive driving habits. All aspects of our programs are very Interesting and informative. All topics covered are easy to understand and will appeal to students of all ages. Taught in the city of Williams Lake BC, using the most up-to-date teaching and visual aids available. In-car instruction conducted in a newer model, dual-controlled vehicle equipped with automatic transmission. The following is some of the services Fourwinds provides: Coming Soon – Graduated Licensing Program (GLP) Defensive Driver Training One-On-One Lessons Convenient Class Program Learners permit program Class 6 motorcycle Class 4 orientation Class 4 practical Road safety planning 10 Roadsence kids- Walk smart, bike safe program. ",http://www.fourwindsdrive.com,Williams Lake,52.1326353,-122.1473917,Fourwinds Driving School 61 – Educational services ,Cariboo,Private Company,61 – Educational services ,2016,1 to 4 
United Greeneries Ltd.,"Here at United Greeneries, we are teachers, students, and innovators when it comes to cannabis. We are a dedicated team of horticulturalists, engineers, scientists, and entrepreneurs that share a passion for growing this future together. We come from a province with a storied legacy of cannabis cultivation which we are proud to contribute to in the new age of cannabis in Canada. We are a product of the history of BC",unitedgreeneries.ca/,Duncan,48.7626366,-123.6876387,United Greeneries Ltd. 31-33 – Manufacturing,Vancouver Island and Coast,Partnership,31-33 – Manufacturing,2020,20 to 49
Costa Canna,"Costa Canna is your premier provincially licensed establishment for high-quality cannabis on Southern Vancouver Island. Costa Canna  clients are our number one priority. We offer the highest quality, lab-tested medicinal and recreational cannabis as we are committed to excellence and social responsibility in all our endeavors. Our team of experts is comprised of industry leaders, staff, and partners devoted to the research, development, and advancement of medical and recreational cannabis. Our objectives include contributing to community outreach programs, job creation, knowledge transfer, and ethical industry standards. We’ve done our research so you don’t have to! Whether you are using cannabis for recreational or medicinal benefits, we encourage you to stop by our shop to find the right products for you.",costacanna.ca/,Duncan,48.7752139,-123.7032251,Costa Canna 44-45 – Retail trade,Vancouver Island and Coast,Partnership,44-45 – Retail trade,2018,20 to 49
Gitanmaax Market,Grocery Store,,Kispiox,55.2618209,-127.6775806,Gitanmaax Market 44-45 – Retail trade,North Coast,Community Owned Company,44-45 – Retail trade,2014,10 to 19
Gitanmaax Food & Fuel,"Fuel, propane, confectionary, canteen, carwash.",,Kispiox,55.2572438,-127.6636951,Gitanmaax Market 44-45 – Retail trade,North Coast,Community Owned Company,44-45 – Retail trade,1994,10 to 19
ALL-BRITE CLEANING,"Cleaning company: Powerwashing and exterior cleaning including window, Carpet/uphostery cleaning including flood restoriation. Also Janitorial cleaning and building maintenance.",allbritecleaning.ca,Victoria ,48.4811334,-123.3809683,ALL-BRITE CLEANING 81 – Other services (except public administration),Vancouver Island and Coast,Private Company,81 – Other services (except public administration),2021,1 to 4
Cayuse Flats Transportation,"Cayuse Flats Transportation is a provider of freight, logistics, and storage solutions to commercial and private clients. Our office and warehouse is located in Lillooet, BC and our crew has been part of the local community for many years. Services include: Freight delivery and hauling services, Hotshot or express service, Warehousing and storage, Medical supplies delivery, Postal and parcel delivery, Refrigerated delivery and Flat deck deliveries.",www.cayuseflats.com, Lillooet ,50.5959084,-122.001815,Cayuse Flats Transportation 48-49 – Transportation and warehousing,Thompson / Okanagan,Community Owned Company,48-49 – Transportation and warehousing,2014,10 to 19
Steeprock Resources Limited,"Our team works hard to provide the following services to clients​ while emphasizing sustainability, safety and quality. Have a particularly complex challenge? We ensure our customers are receiving the best, cost effective solutions by partnering with like-minded professional service providers.",,Pouce Coupe,55.6466769,-120.4512142,"Steeprock Resources Limited 21 – Mining, quarrying, and oil and gas extraction",Northeast,Partnership,"21 – Mining, quarrying, and oil and gas extraction",1989,100 to 199
RidgePro Painting,"From new construction, interiors and exteriors to repaints, we do it all. We provide the highest quality work with over 16 years experience. For your next project, be sure to give us a call.",http://www.ridgepropainting.ca,Maple Ridge,49.2024937,-122.5647468,RidgePro Painting 23 – Construction,Lower Mainland / Southwest,Private Company,23 – Construction,2021,1 to 4
All Safe Traffic Control Inc,"All Safe Traffic Control Inc. is a leading traffic control company with extensive experience in traffic control and road safety. We have extensive expertise in different traffic and road construction and emergency scenarios, and we also specialize in Hwy work. We have completed several high-profile traffic control projects and achieved great success. We have worked well with ministry representatives, superintendents, and emergency response organizations. All Safe Traffic Control Inc. has several years of experience working with rapid emergency response and incidents, including forest and property fires, floods, landslides. We provide professional, reliable service across British Columbia's Okanagan Region. We currently offer service in and areas around Kelowna, West Kelowna, Vernon, Merritt, Penticton, Salmon Arm and Peachland. We have many hardworking and competent workers that are experienced with highway and paving work. The province fully licenses all of our employees as certified Traffic Control Persons. We are fully insured with WCB coverage and carry full liability insurance.",http://allsafetraffic.com,Peachland,49.785176,-119.7250858,All Safe Traffic Control Inc 23 – Construction,Thompson / Okanagan,Private Company,23 – Construction,2007,10 to 19
Vancouver Blues Around Town,"Vancouver Blues Around Town presents and promotes Live Blues Music in Vancouver, BC Canada.",vancouverblues.ca/,Vancouver,49.2682231,-123.1492322,"Vancouver Blues Around Town 71 – Arts, entertainment and recreation",Lower Mainland / Southwest,Private Company,"71 – Arts, entertainment and recreation",2016,1 to 4
Aligned Industrial Services,Aligned Industrial is a Mechanical contractor specializing in structural steel and pressure pipe installations. We are certified under the CWB in CSA standard W47.1 Division 2 and are a class 'A' contractor certified to weld and install process and boiler piping.,http://www.alignedindustrial.com,Coquitlam,49.2251843,-122.8372707,Aligned Industrial Services 23 – Construction,Lower Mainland / Southwest,Private Company,23 – Construction,2018,10 to 19
Alpha Concrete Pumping Ltd.,We are a family owned/operated Concrete Pumping company in the Fraser Valley.,http://www.alphaconcretepumping.com,Abbotsford,49.1034234,-122.2579019,Alpha Concrete Pumping Ltd 23 – Construction,Lower Mainland / Southwest,Private Company,23 – Construction,2006,5 to 9
Complete Safety Services Inc,"Complete Safety Services Inc. specialize in a variety of services including safety, medics, traffic control and pilot truck and hotshot services. We are the one-stop shop for anything safety. Servicing Western Canada’s Oil & Gas and Construction Industries, Our team of qualified personnel have solidified their reputation as a reliable and trustworthy contractor in British Columbia and Alberta.",completesafety.ca,Fort St John,56.2464707,-120.8363512,23 – Construction,Northeast,Private Company,23 – Construction,2010,5 to 9
Pacific Rim Drain Cleaning,"Blocked Sewer/Perimetre/Driveway Drains: auger, root cutting, camera pipeline inspection and flush including line depth available on USB stick. General services including plugged toilets, roof stacks, grease trap lines, plugged or slow draining sinks, and kitchen/laundry/bathtub lines",pacificrimdrain.com,Nanaimo,49.216621,-123.9507837,"Pacific Rim Drain Cleaning 56 – Administrative and support, waste management and remediation services",Vancouver Island and Coast,Private Company,"56 – Administrative and support, waste management and remediation services",2007,1 to 4
RiverStone Holistic Day Spa,"Day Spa featuring Waxing, Facials, Manicures, Pedicures, Aromatherapy Massage, Hot Stone Massage, Thai Stem Massage, Reiki, Chartered Herbalist",http://riverstoneholisticdayspa.com,Witset,55.0190888,-127.3319454,RiverStone Holistic Day Spa 44-45 – Retail trade,North Coast,Private Company,44-45 – Retail trade,2009,1 to 4
Jelly Digital Marketing & PR,"We are a high-energy team of go-getters, storytellers, and experts in all things digital who work tirelessly to get your business, product, and message seen and heard by the right people. While social media, PR, and digital advertising are the pillars of our business, it is our unique ability to combine the trio that enables us to provide comprehensive amplification for your brand.",jellymarketing.ca/,Langley,49.1647292,-122.5852375,Jelly Digital Marketing & PR 81 – Other services (except public administration),Lower Mainland / Southwest,Private Company,81 – Other services (except public administration),2016,1 to 4
The Brush & Wand Studio,We teach art and magic lessons. We give a free trial class! As well we offer professional services like art commissions and magic shows for all types of events.,http://brushandwand.com,Vancouver,49.2638803,-123.206394,"The Brush & Wand Studio 71 – Arts, entertainment and recreation",Lower Mainland / Southwest,Partnership,"71 – Arts, entertainment and recreation",2012,1 to 4
TNT Bookkeeping,Full cycle bookkeeping services provided,,Prince George,53.8825578,-122.7774812,TNT Bookkeeping,Nechako,Private Company,52 – Finance and insurance,2000,1 to 4
Huu-Miis & Tuhmapt Counselling Services,"Huu-Miis (red cedar) & Tuhmapt (spruce) Counselling Services provides Clinical Counselling. Amber is a registered social worker through the BC College of Social Workers. She holds a MSW specializing in Indigenous Trauma & Resiliency. Amber provides individual counselling, to adults, youth and children. As a Nuu chah nulth woman, Amber understands the effects of colonization, residential schools and inter-generational trauma has on the mind, body and soul.",,Ucluelet,49.2690655,-125.1479364,Huu-Miis & Tuhmapt Counselling Services 62 – Health care and social assistance,Vancouver Island and Coast,Private Company,62 – Health care and social assistance,2021,1 to 4
Luxton Construction Plains Inc.,Luxton Construction Plains Inc. is an Indigenous owned and operated business under the Luxton group of companies. Luxton Construction Plains is a full-service general contractor allowing our clients to actively engage and expand Indigenous participation on their projects.,,Delta,49.1537162,-122.9718688,Luxton Construction Plains Inc. 23 – Construction,Lower Mainland / Southwest,Private Company,23 – Construction,2020,20 to 49
Coldsnake Digital Corporation,Coldsnake Digital is an indigenous owned software and product development company located on the Sḵwx̱wú7mesh (Squamish Nation). We specialize in mobile and web development.,www.coldsnakedigital.com,West Vancouver,49.3257894,-123.137838,"Coldsnake Digital Corporation 54 – Professional, scientific and technical services",Lower Mainland / Southwest,Private Company,": 54 – Professional, scientific and technical services",2013,5 to 9
Canam Safety Ventures Inc.,https://canamsafetyventures.com,canamsafetyventures.com,Langley,49.1267213,-122.6677506,Canam Safety Ventures Inc. 23 – Construction,Lower Mainland / Southwest,Private Company,23 – Construction,2019,1 to 4
RoofTop Tents,"Roof Top Tents brings you the ease and comfort of camping to your vehicle, trailer, or any rig you can think of. Looking for a great way to see Vancouver Island and mainland British Columbia? Look no further than Roof Top Tents. We offer fibreglass hard shell tents that install easily to the top of your vehicle. These tents are durable, quality-made and an affordable option to camping – no campsite required. Our showroom is located in beautiful Nanaimo, Vancouver Island BC. We are happy to show you the roof tents in person and come try them out to see if you like them. We also can ship your roof tent to Vancouver and other parts of BC.",rooftoptents.ca/,Nanaimo,49.0826687,-123.9931793,RoofTop Tents 44-45 – Retail trade,Vancouver Island and Coast,Private Company,44-45 – Retail trade,,1 to 4
Evolution Business Marketing & Communications,"Our team of marketing specialists work hard to deliver outstanding results for all of our clients. As a full-service marketing agency in Nanaimo, we combine creative ideas with vast experience in marketing technologies to deliver measurable results for our clients. We will help you to build a sustainable, meaningful relationship with your clients by engaging them with your brand using the latest in communication strategies.",,Nanaimo,49.1613725,-123.9419187,Evolution Business Marketing & Communications 81 – Other services (except public administration),Vancouver Island and Coast,Private Company,81 – Other services (except public administration),2011,1 to 4
NATIONAL VENT FIRE PREVENTION,"WE CLEAN COMMERCIAL KITCHEN RESTAURANT GREASE EXHAUST SYSTEMS. WE SERVICE GREATER VANCOUVER, VANCOUVER ISLAND AND THE INTERIOR REGIONS OF BC.",http://nationalvent.biz,Chilliwack,49.1344389,-121.9643429,NATIONAL VENT FIRE PREVENTION 81 – Other services (except public administration),Lower Mainland / Southwest,Private Company,81 – Other services (except public administration),,5 to 9
Shadow Ent Ltd.,Gravel Haul Truck and Trailer,,Fort St. John,62.37798,-140.8792937,Shadow Ent Ltd. 48-49 – Transportation and warehousing,Northeast,Private Company,48-49 – Transportation and warehousing,1978,1 to 4
?Akisq'nuk Development Corporation,,,Windermere,50.4636112,-115.9888889,"?Akisq'nuk Development Corporation, 55 - Management of companies and enterprises",Kootenay,Development Corporation,55 - Management of companies and enterprises,,
